{
  "schemaVersion": 3,
  "appVersion": "3.1",
  "generatedAt": "2026-08-13T22:08:00-04:00",
  "searchName": "Fluxology curated shopping deals",
  "currency": "CAD",
  "formatNotes": "Pretty-printed intentionally so connector line-range reads are reliable. Historical/inactive calibration-only records belong in historical-listings.json and shipping-calibration.json; unresolved short-link/screenshot records belong in unresolved-listings.json. Only currently direct-validated records may have active=true.",
  "listings": [
    {
      "id": "ebay-267743096355",
      "itemId": "267743096355",
      "category": "Bulk LEGO",
      "searchName": "Bulk LEGO Deal Watch",
      "title": "LEGO Bricks and Pieces Bulk Lot Mixed Themes 10 Pounds Bricks Parts & Figures",
      "marketplace": "eBay",
      "url": "https://www.ebay.com/itm/267743096355",
      "listingType": "buy_it_now",
      "status": "purchased",
      "active": false,
      "seller": "goodwillsocalshop",
      "weightLb": 10,
      "priceCad": 66.29,
      "shippingCad": 41.65,
      "shippingResolved": true,
      "landedCadPerLb": 10.79,
      "allInCadPerLb": 12.19,
      "qualityGrade": "B",
      "summary": "Purchased 10 lb mixed genuine LEGO lot with parts and figures; cross-border shipping pushed the landed cost slightly above the nominal C$10/lb benchmark.",
      "notes": "Recovered from the exact pre-rebuild snapshot; benchmark purchase."
    },
    {
      "id": "ebay-336726698564",
      "itemId": "336726698564",
      "category": "LEGO Minifigures",
      "searchName": "LEGO Specialty & Minifig Watch",
      "title": "LEGO Minifigure Parts & Accessories Bulk Lot, Multicolor, 10+ Pieces",
      "marketplace": "eBay",
      "url": "https://www.ebay.ca/itm/336726698564",
      "listingType": "auction",
      "status": "purchased",
      "active": false,
      "seller": "swissarora",
      "priceUsd": 19.99,
      "shippingUsd": 15.33,
      "taxUsd": 1.99,
      "allInUsd": 37.31,
      "shippingResolved": true,
      "notes": "Won at the opening bid with no competing bids. Visually rich lot of several dozen complete/partial minifigures plus a large accessory pile."
    },
    {
      "id": "ebay-398236132742",
      "itemId": "398236132742",
      "category": "Bulk LEGO",
      "searchName": "Bulk LEGO Deal Watch",
      "title": "LEGO Random Parts Pieces Building Blocks Bulk Lot Sort out Mixed 18 pounds",
      "marketplace": "eBay",
      "url": "https://www.ebay.ca/itm/398236132742",
      "listingType": "buy_it_now",
      "status": "needs_revalidation",
      "active": false,
      "seller": "ZoomTreasury",
      "weightLb": 18,
      "priceCad": 62.99,
      "sellerOfferCad": 55.43,
      "bestOffer": true,
      "shippingCad": 42.17,
      "shippingResolved": true,
      "landedCadAtOffer": 97.6,
      "validationStatus": "needs_revalidation",
      "notes": "M6H 2W9 Canada Post shipping resolved at C$42.17. Photo review found a Friends-heavy, apparently figure-stripped lot, but with useful windows, glazing and architectural parts. Current live state must be revalidated before surfacing."
    },
    {
      "id": "ebay-283582806059",
      "itemId": "283582806059",
      "category": "LEGO Minifigures",
      "searchName": "LEGO Specialty & Minifig Watch",
      "title": "100 Genuine LEGO Minifigure Accessories Random Assortment",
      "marketplace": "eBay",
      "url": "https://www.ebay.ca/itm/283582806059",
      "listingType": "buy_it_now",
      "status": "needs_revalidation",
      "active": false,
      "seller": "The_Brick_World",
      "priceUsd": 20.95,
      "pieceCount": 100,
      "shippingResolved": false,
      "validationStatus": "needs_revalidation",
      "notes": "At least 100 genuine accessories; high priority if M6H shipping or a manual/custom combined-shipping arrangement is favorable. Direct page available only from an old crawl during the 2026-08-13 audit, so do not surface without fresh validation."
    },
    {
      "id": "ebay-331982822376",
      "itemId": "331982822376",
      "category": "LEGO Specialty Parts",
      "searchName": "LEGO Specialty & Minifig Watch",
      "title": "Assorted Genuine LEGO Printed/Decorated Tiles",
      "marketplace": "eBay",
      "url": "https://www.ebay.ca/itm/331982822376",
      "listingType": "buy_it_now",
      "status": "tracked",
      "active": true,
      "seller": "Bluebird Brick Designs",
      "priceUsd": 2.29,
      "shippingResolved": false,
      "validationStatus": "live_canonical_verified",
      "lastSeen": "2026-08-13T22:08:00-04:00",
      "notes": "Priority-1 diverse printed-tile assortment; quantity tiers 10/25/50/100. Current direct canonical page showed item 331982822376 with 5 available/121 sold. Seller states larger lots increase variety and combines shipping; M6H shipping remains unresolved."
    },
    {
      "id": "ebay-126477737031",
      "itemId": "126477737031",
      "category": "LEGO Specialty Parts",
      "searchName": "LEGO Specialty & Minifig Watch",
      "title": "LEGO Printed Tiles & Slopes 2x2 - 1x2 - 1x1 Decorations Minifigure Accessory NEW",
      "marketplace": "eBay",
      "url": "https://www.ebay.ca/itm/126477737031",
      "listingType": "buy_it_now",
      "status": "tracked",
      "active": true,
      "seller": "Dumbosmother",
      "priceUsd": 1.19,
      "shippingResolved": false,
      "shippingObservationAvailable": true,
      "bestOffer": false,
      "firstSeen": "2026-08-12T17:37:44-04:00",
      "lastSeen": "2026-08-13T22:08:00-04:00",
      "lastChanged": "2026-08-11T18:49:09-04:00",
      "validationStatus": "live_canonical_verified",
      "notes": "Priority-1 pick-your-own genuine printed/decorated tile listing. Current direct canonical page confirmed item 126477737031. No single listing-wide M6H shipping value exists because pricing varies by selection/cart. A destination-resolved 24-piece checkout test produced US$48.10 shipping on US$36.34 merchandise; advertised automatic combined shipping was not economical, so manual seller bundle/custom listing is preferred."
    },
    {
      "id": "ebay-295918613949",
      "itemId": "295918613949",
      "category": "LEGO Specialty Parts",
      "searchName": "LEGO Specialty & Minifig Watch",
      "title": "56 Genuine LEGO Windows & Doors",
      "marketplace": "eBay",
      "url": "https://www.ebay.ca/itm/295918613949",
      "listingType": "buy_it_now",
      "status": "needs_revalidation",
      "active": false,
      "seller": "mfonlinesails15",
      "priceUsd": 18.0,
      "pieceCount": 56,
      "shippingResolved": false,
      "validationStatus": "needs_revalidation",
      "notes": "Architectural opening assortment; Toronto shipping unresolved. Direct canonical fetch failed during the 2026-08-13 audit, so revalidate before surfacing."
    },
    {
      "id": "ebay-377161076694",
      "itemId": "377161076694",
      "category": "LEGO Minifigures",
      "searchName": "LEGO Specialty & Minifig Watch",
      "title": "Rare Included LEGO Bulk Minifigure Lot of 10 Genuine & Accessories",
      "marketplace": "eBay",
      "url": "https://www.ebay.ca/itm/377161076694",
      "listingType": "buy_it_now",
      "status": "needs_revalidation",
      "active": false,
      "seller": "Boutique Charlie Pooh",
      "priceCad": 29.96,
      "sellerOfferCad": 25.47,
      "shippingCad": 8.91,
      "shippingResolved": true,
      "nominalFigureCount": 10,
      "validationStatus": "needs_revalidation",
      "notes": "Seller-offer observation. Listing photos are sample/source-pool imagery rather than the exact ten-figure lot. C$34.38 pre-tax at the observed offer; direct canonical fetch failed during the 2026-08-13 audit."
    },
    {
      "id": "ebay-147422814961",
      "itemId": "147422814961",
      "category": "LEGO Specialty Parts",
      "searchName": "LEGO Specialty & Minifig Watch",
      "title": "110 Genuine LEGO City/Friends Printed & Stickered Decorative Tiles/Pieces",
      "marketplace": "eBay",
      "url": "https://www.ebay.ca/itm/147422814961",
      "listingType": "buy_it_now",
      "status": "needs_revalidation",
      "active": false,
      "seller": "JD Fox Shop",
      "priceUsd": 29.99,
      "pieceCount": 110,
      "bestOffer": true,
      "shippingResolved": false,
      "validationStatus": "needs_revalidation",
      "notes": "Priority-1 pictured assortment with strong diversity potential. Toronto shipping unresolved. Direct canonical fetch failed during the 2026-08-13 audit."
    },
    {
      "id": "ebay-318668761237",
      "itemId": "318668761237",
      "category": "LEGO Minifigures",
      "searchName": "LEGO Specialty & Minifig Watch",
      "title": "Huge Lego Minecraft Super Heroes City, different themes Minifigure Lot Of 27",
      "marketplace": "eBay",
      "url": "https://www.ebay.ca/itm/318668761237",
      "listingType": "buy_it_now",
      "status": "needs_revalidation",
      "active": false,
      "seller": "zaxh314l",
      "priceCad": 62.0,
      "sellerOfferCad": 58.9,
      "shippingCad": 10.8,
      "shippingResolved": true,
      "nominalFigureCount": 27,
      "bestOffer": true,
      "validationStatus": "needs_revalidation",
      "notes": "Observed C$69.70 pre-tax at seller offer = C$2.58 per nominal figure before assigning value to the crocodile. Direct canonical fetch failed during the 2026-08-13 audit."
    },
    {
      "id": "ebay-377251449356",
      "itemId": "377251449356",
      "category": "LEGO Minifigures",
      "searchName": "LEGO Specialty & Minifig Watch",
      "title": "LEGO VARIETY LOT OF MINIFIGS- LOT OF 14- MUST SEE!",
      "marketplace": "eBay",
      "url": "https://www.ebay.ca/itm/377251449356",
      "listingType": "buy_it_now",
      "status": "needs_revalidation",
      "active": false,
      "seller": "Mimi's 4 Munchkins",
      "priceUsd": 17.59,
      "shippingUsd": 16.21,
      "shippingResolved": true,
      "nominalFigureCount": 14,
      "bestOffer": true,